{
  "documents": [
    {
      "id": "DOC-04-ARCHITECTURE-OVERVIEW",
      "path": "04-architecture/architecture-overview.md",
      "owner": "R05",
      "status": "proposed"
    },
    {
      "id": "DOC-04-C4-CONTEXT-CONTAINERS-COMPONENTS",
      "path": "04-architecture/c4-context-containers-components.md",
      "owner": "R05",
      "status": "proposed"
    },
    {
      "id": "DOC-04-DEPLOYMENT-AND-NETWORK",
      "path": "04-architecture/deployment-and-network.md",
      "owner": "R05",
      "status": "proposed"
    },
    {
      "id": "DOC-04-MODULAR-BOUNDARIES-AND-DEPENDENCIES",
      "path": "04-architecture/modular-boundaries-and-dependencies.md",
      "owner": "R05",
      "status": "proposed"
    },
    {
      "id": "DOC-04-NEXTJS-ARCHITECTURE",
      "path": "04-architecture/nextjs-architecture.md",
      "owner": "R05",
      "status": "proposed"
    },
    {
      "id": "DOC-04-NESTJS-ARCHITECTURE",
      "path": "04-architecture/nestjs-architecture.md",
      "owner": "R05",
      "status": "proposed"
    },
    {
      "id": "DOC-04-TENANCY-IDENTITY-AUTHORIZATION",
      "path": "04-architecture/tenancy-identity-authorization.md",
      "owner": "R05",
      "status": "proposed"
    },
    {
      "id": "DOC-04-CONFIGURATION-AND-FEATURE-CONTROL",
      "path": "04-architecture/configuration-and-feature-control.md",
      "owner": "R05",
      "status": "proposed"
    },
    {
      "id": "DOC-04-TRANSACTIONS-EVENTS-WORKFLOWS",
      "path": "04-architecture/transactions-events-workflows.md",
      "owner": "R05",
      "status": "proposed"
    },
    {
      "id": "DOC-04-CACHING-AND-CONSISTENCY",
      "path": "04-architecture/caching-and-consistency.md",
      "owner": "R05",
      "status": "proposed"
    },
    {
      "id": "DOC-04-RESILIENCY-AND-DEPENDENCY-ISOLATION",
      "path": "04-architecture/resiliency-and-dependency-isolation.md",
      "owner": "R05",
      "status": "proposed"
    },
    {
      "id": "DOC-04-SCALABILITY-AND-CAPACITY",
      "path": "04-architecture/scalability-and-capacity.md",
      "owner": "R05",
      "status": "proposed"
    },
    {
      "id": "DOC-04-ADR-01",
      "path": "04-architecture/adr/ADR-01.md",
      "owner": "R05",
      "status": "proposed"
    },
    {
      "id": "DOC-04-ADR-02",
      "path": "04-architecture/adr/ADR-02.md",
      "owner": "R07",
      "status": "proposed"
    },
    {
      "id": "DOC-04-ADR-03",
      "path": "04-architecture/adr/ADR-03.md",
      "owner": "R08",
      "status": "proposed"
    },
    {
      "id": "DOC-04-ADR-04",
      "path": "04-architecture/adr/ADR-04.md",
      "owner": "R10",
      "status": "proposed"
    },
    {
      "id": "DOC-04-ADR-05",
      "path": "04-architecture/adr/ADR-05.md",
      "owner": "R09",
      "status": "proposed"
    },
    {
      "id": "DOC-04-ADR-06",
      "path": "04-architecture/adr/ADR-06.md",
      "owner": "R11",
      "status": "proposed"
    },
    {
      "id": "DOC-04-ADR-07",
      "path": "04-architecture/adr/ADR-07.md",
      "owner": "R07",
      "status": "proposed"
    },
    {
      "id": "DOC-04-ADR-08",
      "path": "04-architecture/adr/ADR-08.md",
      "owner": "R12",
      "status": "proposed"
    },
    {
      "id": "DOC-04-ADR-09",
      "path": "04-architecture/adr/ADR-09.md",
      "owner": "R09",
      "status": "proposed"
    },
    {
      "id": "DOC-04-ADR-10",
      "path": "04-architecture/adr/ADR-10.md",
      "owner": "R08",
      "status": "proposed"
    },
    {
      "id": "DOC-04-ADR-11",
      "path": "04-architecture/adr/ADR-11.md",
      "owner": "R14",
      "status": "proposed"
    },
    {
      "id": "DOC-04-ADR-12",
      "path": "04-architecture/adr/ADR-12.md",
      "owner": "R21",
      "status": "proposed"
    },
    {
      "id": "DOC-04-ADR-13",
      "path": "04-architecture/adr/ADR-13.md",
      "owner": "R14",
      "status": "proposed"
    },
    {
      "id": "DOC-04-ADR-14",
      "path": "04-architecture/adr/ADR-14.md",
      "owner": "R05",
      "status": "proposed"
    },
    {
      "id": "DOC-05-DOMAIN-MODEL-AND-ERD",
      "path": "05-data/domain-model-and-erd.md",
      "owner": "R10",
      "status": "proposed"
    },
    {
      "id": "DOC-05-DATA-DICTIONARY",
      "path": "05-data/data-dictionary.md",
      "owner": "R10",
      "status": "proposed"
    },
    {
      "id": "DOC-05-AGGREGATE-AND-TRANSACTION-BOUNDARIES",
      "path": "05-data/aggregate-and-transaction-boundaries.md",
      "owner": "R10",
      "status": "proposed"
    },
    {
      "id": "DOC-05-DATABASE-INDEXING-AND-QUERY-PLANS",
      "path": "05-data/database-indexing-and-query-plans.md",
      "owner": "R10",
      "status": "proposed"
    },
    {
      "id": "DOC-05-LEDGER-AND-MONEY",
      "path": "05-data/ledger-and-money.md",
      "owner": "R12",
      "status": "proposed"
    },
    {
      "id": "DOC-05-MIGRATIONS-BACKFILLS-AND-VERSIONING",
      "path": "05-data/migrations-backfills-and-versioning.md",
      "owner": "R10",
      "status": "proposed"
    },
    {
      "id": "DOC-05-RETENTION-PRIVACY-AND-RECORD-LIFECYCLE",
      "path": "05-data/retention-privacy-and-record-lifecycle.md",
      "owner": "R10",
      "status": "proposed"
    },
    {
      "id": "DOC-05-FILES-AND-DOCUMENT-SECURITY",
      "path": "05-data/files-and-document-security.md",
      "owner": "R10",
      "status": "proposed"
    },
    {
      "id": "DOC-05-IMPORT-EXPORT-AND-BULK-PROCESSING",
      "path": "05-data/import-export-and-bulk-processing.md",
      "owner": "R10",
      "status": "proposed"
    },
    {
      "id": "DOC-05-ANALYTICS-DATA-BOUNDARIES",
      "path": "05-data/analytics-data-boundaries.md",
      "owner": "R10",
      "status": "proposed"
    },
    {
      "id": "DOC-07-PARTNER-INTEGRATION-HUB",
      "path": "07-integrations/partner-integration-hub.md",
      "owner": "R09",
      "status": "proposed"
    },
    {
      "id": "DOC-07-ADAPTER-SDK-CONTRACT",
      "path": "07-integrations/adapter-sdk-contract.md",
      "owner": "R09",
      "status": "proposed"
    },
    {
      "id": "DOC-07-CAPABILITY-NEGOTIATION",
      "path": "07-integrations/capability-negotiation.md",
      "owner": "R09",
      "status": "proposed"
    },
    {
      "id": "DOC-07-MAPPING-TRANSFORMATION-AND-VALIDATION",
      "path": "07-integrations/mapping-transformation-and-validation.md",
      "owner": "R09",
      "status": "proposed"
    },
    {
      "id": "DOC-07-AUTHENTICATION-AND-SECRETS",
      "path": "07-integrations/authentication-and-secrets.md",
      "owner": "R09",
      "status": "proposed"
    },
    {
      "id": "DOC-07-PURCHASE-SUBMISSION-AND-ISSUANCE",
      "path": "07-integrations/purchase-submission-and-issuance.md",
      "owner": "R09",
      "status": "proposed"
    },
    {
      "id": "DOC-07-CALLBACKS-POLLING-AND-RECONCILIATION",
      "path": "07-integrations/callbacks-polling-and-reconciliation.md",
      "owner": "R09",
      "status": "proposed"
    },
    {
      "id": "DOC-07-DELIVERY-RETRIES-DEDUPLICATION",
      "path": "07-integrations/delivery-retries-deduplication.md",
      "owner": "R09",
      "status": "proposed"
    },
    {
      "id": "DOC-07-INTEGRATION-STUDIO",
      "path": "07-integrations/integration-studio.md",
      "owner": "R09",
      "status": "proposed"
    },
    {
      "id": "DOC-07-PARTNER-ONBOARDING-CERTIFICATION",
      "path": "07-integrations/partner-onboarding-certification.md",
      "owner": "R09",
      "status": "proposed"
    },
    {
      "id": "DOC-07-CARRIER-CONTRACT-TEMPLATE",
      "path": "07-integrations/carrier-contract-template.md",
      "owner": "R09",
      "status": "proposed"
    },
    {
      "id": "DOC-07-PAYMENT-PROVIDER-CONTRACT-TEMPLATE",
      "path": "07-integrations/payment-provider-contract-template.md",
      "owner": "R09",
      "status": "proposed"
    },
    {
      "id": "DOC-07-AUTOMOTIVE-PROVIDER-CONTRACT-TEMPLATE",
      "path": "07-integrations/automotive-provider-contract-template.md",
      "owner": "R09",
      "status": "proposed"
    },
    {
      "id": "DOC-07-NOTIFICATION-HR-LOGISTICS-CONTRACTS",
      "path": "07-integrations/notification-hr-logistics-contracts.md",
      "owner": "R09",
      "status": "proposed"
    },
    {
      "id": "DOC-07-REST-JSON",
      "path": "07-integrations/simulated-carriers/rest-json.md",
      "owner": "R09",
      "status": "proposed"
    },
    {
      "id": "DOC-07-SOAP-XML",
      "path": "07-integrations/simulated-carriers/soap-xml.md",
      "owner": "R09",
      "status": "proposed"
    },
    {
      "id": "DOC-07-SIGNED-HTTP",
      "path": "07-integrations/simulated-carriers/signed-http.md",
      "owner": "R09",
      "status": "proposed"
    },
    {
      "id": "DOC-08-THREAT-MODEL-AND-TRUST-BOUNDARIES",
      "path": "08-security/threat-model-and-trust-boundaries.md",
      "owner": "R11",
      "status": "proposed"
    },
    {
      "id": "DOC-08-AUTHORIZATION-AND-TENANT-ISOLATION",
      "path": "08-security/authorization-and-tenant-isolation.md",
      "owner": "R11",
      "status": "proposed"
    },
    {
      "id": "DOC-08-PRIVACY-DATA-CLASSIFICATION-AND-CONSENT",
      "path": "08-security/privacy-data-classification-and-consent.md",
      "owner": "R11",
      "status": "proposed"
    },
    {
      "id": "DOC-08-AUTHENTICATION-SESSIONS-AND-PRIVILEGED-ACCESS",
      "path": "08-security/authentication-sessions-and-privileged-access.md",
      "owner": "R11",
      "status": "proposed"
    },
    {
      "id": "DOC-08-SECURE-DEVELOPMENT-AND-API-CONTROLS",
      "path": "08-security/secure-development-and-api-controls.md",
      "owner": "R11",
      "status": "proposed"
    },
    {
      "id": "DOC-08-SECRETS-ENCRYPTION-AND-AUDIT",
      "path": "08-security/secrets-encryption-and-audit.md",
      "owner": "R11",
      "status": "proposed"
    },
    {
      "id": "DOC-08-ABUSE-FRAUD-AND-RATE-LIMITS",